{
  "schema_version": "1.0.0",
  "certificate_type": "URF-ADM",
  "admissibility": {
    "regime": "refinement",
    "locality": "FOk",
    "degree_bound": 3,
    "no_global_state": true
  },
  "evidence": {
    "artifacts": [
      {
        "path": "tests/artifacts/example.txt",
        "sha256": "f3ab28aaa17417e3cf92002fa7a86f0b2989c5e6f44cc27ea4be015a532571f1"
      }
    ]
  }
}

